{"media_id":"22222222-2222-4222-8222-222222222222","duplicate":false,"status":"reserved","upload_url":"https://upload.example.test/object","object_key":"originals/22222222-2222-4222-8222-222222222222/aaaaaaaa/cassowary.jpg","expires_in_seconds":900,"upload_headers":{"Content-Type":"image/jpeg","x-amz-meta-sha256":"aaaaaaaaaaaaaaaaaaaaaaaaaaaaaaaaaaaaaaaaaaaaaaaaaaaaaaaaaaaaaaaa"}}
